,name,followers,degree_centrality,category,geodata,location,phone,email,webpage,twitter,description,Unnamed: 11,geoloc,point,latitude,longitude,altitude
169,cioff france,4544,12.72829131652661,education,,le montel 63600 ambert france,,,,,,,"Le Montel, Grandval, Ambert, Puy-de-Dôme, Auvergne-Rhône-Alpes, France métropolitaine, 63890, France","(45.6131481, 3.6581522, 0.0)",45.6131481,3.6581522,0.0
170,citf commision internationale du theater francophone,1792,5.019607843137255,education,,182 rue sainthonoré 75001 paris,,,,,,,,,,,
171,codata,1283,3.5938375350140057,education,,5 rue auguste vacquerie 75016 paris france,,,,,,,"5, Rue Auguste Vacquerie, Quartier de Chaillot, Paris 16e Arrondissement, Paris, Île-de-France, France métropolitaine, 75116, France","(48.8708187, 2.2963325, 0.0)",48.8708187,2.2963325,0.0
172,colletif de parties civiles pour le rwanda cpcr,2513,7.03921568627451,human rights democracy and governance,,61 avenue jean jaurès 51100 reims,,,,,,,"61, Avenue Jean Jaurès, Secteur Sainte-Thérèse, Reims, Marne, Grand Est, France métropolitaine, 51100, France","(49.2591581, 4.0439714, 0.0)",49.2591581,4.0439714,0.0
173,college de paris afrique,5423,15.19047619047619,education,,15 rue montmartre 75001 paris france,,,,,,,"Le Cochon à l'Oreille, 15, Rue Montmartre, Quartier Les Halles, Paris 1er Arrondissement, Paris, Île-de-France, France métropolitaine, 75001, France","(48.8644516, 2.3451744, 0.0)",48.8644516,2.3451744,0.0
174,college des etudes juives,313,0.876750700280112,education,,6 bis rue michel ange 75016 paris,,,,,,,"Rue Michel-Ange, Quartier d'Auteuil, Paris 16e Arrondissement, Paris, Île-de-France, France métropolitaine, 75016, France","(48.8429159, 2.2599868, 0.0)",48.8429159,2.2599868,0.0
175,comite de cooperation aves le laos,792,2.2184873949579833,economic recovery and development,,0 rue rosenwald 75015 paris france,,,,,,,"Rue Rosenwald, Quartier Saint-Lambert, Paris 15e Arrondissement, Paris, Île-de-France, France métropolitaine, 75015, France","(48.833108, 2.3058573, 0.0)",48.833108,2.3058573,0.0
176,comite idaho france,16681,46.72549019607843,human rights democracy and governance,,26 rue de lappe 75011 paris france,,,,,,,"Bar à Nenette, 26, Rue de Lappe, Quartier de la Roquette, Paris 11e Arrondissement, Paris, Île-de-France, France métropolitaine, 75011, France","(48.853326, 2.3733565, 0.0)",48.853326,2.3733565,0.0
177,communautes catholiques francophones dans le monde,842,2.358543417366947,education,,58 avenue de breteuil 75007 paris france,,,,,,,"Avenue de Breteuil, Quartier de l'École Militaire, Paris 7e Arrondissement, Paris, Île-de-France, France métropolitaine, 75007, France","(48.8517067, 2.3125359, 0.0)",48.8517067,2.3125359,0.0
179,congregation notre dame de sion,463,1.2969187675070029,education,,69 rue notredame des champs 75006,,,,,,,,,,,
180,coordination pour l'afrique de demain cade,186,0.5210084033613446,environment,,5 rue des immeubles industriels 75011 paris france,,,,,,,"5, Rue des Immeubles Industriels, Quartier Sainte-Marguerite, Paris 11e Arrondissement, Paris, Île-de-France, France métropolitaine, 75011, France","(48.8493561, 2.3927206, 0.0)",48.8493561,2.3927206,0.0
181,cousteau,61517,172.31652661064425,environment,,40 rue des renaudes 75017 paris france,,,,,,,"40, Rue des Renaudes, Quartier des Ternes, Paris 17e Arrondissement, Paris, Île-de-France, France métropolitaine, 75017, France","(48.8809893, 2.2974877, 0.0)",48.8809893,2.2974877,0.0
182,cpie bocage de l'avesnois,1294,3.6246498599439776,environment,,1 chem des prés verquin 59570 gussignies france,,,,,,,,,,,
183,conseil representatif des associations noires cran,13262,37.148459383753504,human rights democracy and governance,,55 rue du château d’eau 75010 paris,,,,,,,"55, Rue du Château d'Eau, Quartier de la Porte-Saint-Martin, Paris 10e Arrondissement, Paris, Île-de-France, France métropolitaine, 75010, France","(48.8723591, 2.3555264, 0.0)",48.8723591,2.3555264,0.0
184,croixrouge francaise,561722,1573.450980392157,humanitarian,,98 rue didot 75694 paris cedex 14,,,,,,,,,,,
187,eau et vie,1953,5.470588235294118,economic recovery and development,,68 rue de coulmiers 44000 nantes france,,,,,,,"68, Rue de Coulmiers, Coulmiers - Jardin des Plantes, Malakoff - Saint-Donatien, Nantes, Loire-Atlantique, Pays de la Loire, France métropolitaine, 44000, France","(47.2249935, -1.539534, 0.0)",47.2249935,-1.539534,0.0
189,european blind union ebu,1637,4.5854341736694675,human rights democracy and governance,,6 rue gagergabillot 75015 paris france,,,,,,,,,,,
190,echoppe usa,171,0.4789915966386555,education,,02 bp 222 53 49022 angers cedex 02 france,,,,,,,,,,,
191,european council of jewish communities ecjc,1487,4.165266106442577,education,,38 rue de berri 75008 paris france,,,,,,,"38, Rue de Berri, Quartier du Faubourg-du-Roule, Paris 8e Arrondissement, Paris, Île-de-France, France métropolitaine, 75008, France","(48.8738967, 2.3070011, 0.0)",48.8738967,2.3070011,0.0
193,ecpm,8058,22.571428571428573,human rights democracy and governance,,62 bis ave parmentier 75011 paris france,,,,,,,,,,,
195,european grassroots antiracist movement egam,4573,12.80952380952381,human rights democracy and governance,,48 ter rue du faubourg saintdenis 75010 paris france,,,,,,,,,,,
196,ecole francaise d'extremeorient efeo,4140,11.596638655462185,education,,22 av du président wilson 75116 paris france,,,,,,,"22, Avenue du Président Wilson, Quartier de Chaillot, Paris 16e Arrondissement, Paris, Île-de-France, France métropolitaine, 75116, France","(48.8644818, 2.2922125, 0.0)",48.8644818,2.2922125,0.0
197,elles bougent,7400,20.72829131652661,education,,57 place de l'europe 92500 rueilmalmaison,,,,,,,,,,,
198,empowher institute,2228,6.240896358543417,human rights democracy and governance,,na,,,,,,,Namibia,"(-23.2335499, 17.3231107, 0.0)",-23.2335499,17.3231107,0.0
199,end fgm,7043,19.72829131652661,protection,,rue d'edimbourg 261050 ixelles belgium,,,,,,,"Rue d'Édimbourg - Edinburgstraat, Matongé, Ixelles - Elsene, Brussel-Hoofdstad - Bruxelles-Capitale, Région de Bruxelles-Capitale - Brussels Hoofdstedelijk Gewest, 1050, België / Belgique / Belgien","(50.8371293, 4.364166, 0.0)",50.8371293,4.364166,0.0
200,enfants du mekong,65410,183.22128851540617,education,,5 rue de la comète 92600 asnièressurseine france,,,,,,,,,,,
202,entrepreneurs du monde,18744,52.50420168067227,economic recovery and development,,14 pass dubail 75010 paris france,,,,,,,"Centre de recherche et d'Information pour le Développement, 14, Passage Dubail, Quartier de la Porte-Saint-Martin, Paris 10e Arrondissement, Paris, Île-de-France, France métropolitaine, 75010, France","(48.8737094, 2.359693, 0.0)",48.8737094,2.359693,0.0
203,epargne ethique,24507,68.6470588235294,economic recovery and development,,22 rue joubert 75009 paris ile de france,,,,,,,"22, Rue Joubert, Quartier de la Chaussée-d'Antin, Paris 9e Arrondissement, Paris, Île-de-France, France métropolitaine, 75009, France","(48.874711, 2.3298358, 0.0)",48.874711,2.3298358,0.0
205,european youth information and counselling agency eryica,6003,16.81512605042017,education,,87 rte de thionville 2611 hesperange luxembourg,,,,,,,"Route de Thionville, Alzingen, Hesperange, Canton Luxembourg, 5887, Lëtzebuerg","(49.5736536, 6.1590288, 0.0)",49.5736536,6.1590288,0.0
206,european school of haematology esh,4201,11.767507002801121,health,,1 avenue claude vellefaux 75010 paris france,,,,,,,"Avenue Claude Vellefaux, Quartier de l'Hôpital Saint-Louis, Paris 10e Arrondissement, Paris, Île-de-France, France métropolitaine, 75010, France","(48.8734011, 2.3701732, 0.0)",48.8734011,2.3701732,0.0
208,eunis,380,1.0644257703081232,education,,103 boulevard saintmichel 75005 paris france,,,,,,,,,,,
209,euromed feminist initiative,12594,35.27731092436975,human rightsdemocracy and governance,,104 rue de charenton 75012 paris france,,,,,,,"104, Rue de Charenton, Quartier de Bercy, Paris 12e Arrondissement, Paris, Île-de-France, France métropolitaine, 75012, France","(48.8474296, 2.3774482, 0.0)",48.8474296,2.3774482,0.0
212,european federation of geologists ,2907,8.142857142857142,environment,,rue jenner 13 1000 bruxelles belgique,,,,,,,"Rue Jenner - Jennerstraat, Bruxelles - Brussel, Ixelles - Elsene, Brussel-Hoofdstad - Bruxelles-Capitale, Région de Bruxelles-Capitale - Brussels Hoofdstedelijk Gewest, 1000, België / Belgique / Belgien","(50.8359303, 4.3787714, 0.0)",50.8359303,4.3787714,0.0
213,european financial management association,1341,3.7563025210084033,education,,10 boulevard haussmann 75009 paris france,,,,,,,"Qwant, 10, Boulevard Haussmann, Quartier du Faubourg-Montmartre, Paris 9e Arrondissement, Paris, Île-de-France, France métropolitaine, 75009, France","(48.8724229, 2.3382238, 0.0)",48.8724229,2.3382238,0.0
214,european forum for urban security efus,1522,4.2633053221288515,protection,,10 rue des montiboeufs 75020 paris france,,,,,,,"10, Rue des Montibœufs, Quartier Saint-Fargeau, Paris 20e Arrondissement, Paris, Île-de-France, France métropolitaine, 75020, France","(48.8664775, 2.4053811, 0.0)",48.8664775,2.4053811,0.0
215,european implementation network,414,1.1596638655462186,human rights democracy and governance,,20 av du neuhof 67100 strasbourg france,,,,,,,"Épicerie boucherie Matmour, 20, Avenue du Neuhof, Neudorf, Strasbourg, Bas-Rhin, Grand Est, France métropolitaine, 67100, France","(48.5553544, 7.7662541, 0.0)",48.5553544,7.7662541,0.0
216,european jewish congress,11732,32.86274509803921,human rights democracy and governance,,38 rue de berri 75008 paris france,,,,,,,"38, Rue de Berri, Quartier du Faubourg-du-Roule, Paris 8e Arrondissement, Paris, Île-de-France, France métropolitaine, 75008, France","(48.8738967, 2.3070011, 0.0)",48.8738967,2.3070011,0.0
217,european producers club,742,2.0784313725490198,education,,42 rue du faubourg du temple 75011 paris france,,,,,,,"Suan Siam, 42, Rue du Faubourg du Temple, Quartier de la Folie-Méricourt, Paris 11e Arrondissement, Paris, Île-de-France, France métropolitaine, 75011, France","(48.8692577, 2.3690106, 0.0)",48.8692577,2.3690106,0.0
218,european society of cardiology,254994,714.2689075630252,health,,2035 route des colles cs 80179 biot 06903 sophia antipolis cedex france,,,,,,,,,,,
219,european rare diseases organization eurodis,40873,114.49019607843137,health,,plateforme maladies rares 96 rue didot 75014 paris france,,,,,,,,,,,
220,euroscience,4483,12.557422969187675,education,,1 quai lezaymarnesia 67000 strasbourg  france,,,,,,,,,,,
221,fafce,1778,4.980392156862745,religious organization,,28 place st georges paris 75009 france,,,,,,,"Place Saint-Georges, Quartier Saint-Georges, Nouvelle Athènes, Paris, Île-de-France, France métropolitaine, 75009, France","(48.8783757, 2.3374412, 0.0)",48.8783757,2.3374412,0.0
222,fatf,24940,69.85994397759103,protection,,2 rue andré pascal 75775 paris cedex 16 france,,,,,,,,,,,
223,feebf,1148,3.215686274509804,religious organization,,47 rue de clichy 75009 paris france,,,,,,,"47, Rue de Clichy, Quartier Saint-Georges, Paris 9e Arrondissement, Paris, Île-de-France, France métropolitaine, 75009, France","(48.8803025, 2.3288409, 0.0)",48.8803025,2.3288409,0.0
225,fédération internationale des experts comptables et commissaires aux comptes francophones fidef,2017,5.649859943977591,professional society,,19 rue cognacq jay 75007 paris france,,,,,,,"19, Rue Cognacq-Jay, Quartier du Gros-Caillou, Paris 7e Arrondissement, Paris, Île-de-France, France métropolitaine, 75007, France","(48.86176, 2.3031012, 0.0)",48.86176,2.3031012,0.0
226,federation euromediterraneenne contre les disparitions forcees,1806,5.0588235294117645,human rights democracy and governance,,112 rue de charenton 75012 paris france,,,,,,,"112, Rue de Charenton, Quartier de Bercy, Paris 12e Arrondissement, Paris, Île-de-France, France métropolitaine, 75012, France","(48.8470293, 2.3780432, 0.0)",48.8470293,2.3780432,0.0
227,federation nationale de la libere pensee,3249,9.100840336134453,human rights democracy and governance,,10 rue des fossés saintjacques 75005 paris france,,,,,,,,,,,
228,international federation for human rights fidh,210879,590.6974789915967,human rights democracy and governance,,17 pass de la main d'or 75011 paris france,,,,,,,"17, Passage de la Main d'Or, Quartier Sainte-Marguerite, Paris 11e Arrondissement, Paris, Île-de-France, France métropolitaine, 75011, France","(48.8526699, 2.3782056, 0.0)",48.8526699,2.3782056,0.0
229,filles du saintespirt,845,2.3669467787114846,religious organization,,15 bd sebastopol 35101 rennes cedex 2 france,,,,,,,,,,,
230,fils de la charite,1425,3.991596638655462,religious organization,,22 rue de l'abbé derry 92130 issylesmoulineaux france,,,,,,,,,,,
231,fondation de france,70572,197.68067226890756,cso,,40 av hoche 75008 paris france,,,,,,,"40, Avenue Hoche, Quartier du Faubourg-du-Roule, Paris 8e Arrondissement, Paris, Île-de-France, France métropolitaine, 75008, France","(48.8755373, 2.2987971, 0.0)",48.8755373,2.2987971,0.0
232,fondation maison des sciences de l'homme,9628,26.969187675070028,education,,54 bd raspail 75006 paris france,,,,,,,"Maison des Sciences de l'Homme - MSH - EHESS, 54, Boulevard Raspail, Quartier du Montparnasse, Paris 14e Arrondissement, Paris, Île-de-France, France métropolitaine, 75006, France","(48.850231300000004, 2.326797041094853, 0.0)",48.850231300000004,2.326797041094853,0.0
233,fondation mfr monde,587,1.6442577030812324,education,,58 rue notre dame de lorette 75009 paris,,,,,,,"58, Rue Notre-Dame-de-Lorette, Quartier Saint-Georges, Paris 9e Arrondissement, Paris, Île-de-France, France métropolitaine, 75009, France","(48.8799925, 2.3357441, 0.0)",48.8799925,2.3357441,0.0
234,fondation napoleon,18243,51.10084033613445,education,,7 rue geoffroy saint hilaire 75005 paris france,,,,,,,"7, Rue Geoffroy Saint-Hilaire, Quartier du Jardin des Plantes, Paris 5e Arrondissement, Paris, Île-de-France, France métropolitaine, 75005, France","(48.8389365, 2.3567846, 0.0)",48.8389365,2.3567846,0.0
235,forum refugiescosi,6993,19.58823529411765,human rights democracy and governance,,3 bd richard lenoir 75011 paris france,,,,,,,"3, Boulevard Richard-Lenoir, Quartier de la Folie-Méricourt, Paris 11e Arrondissement, Paris, Île-de-France, France métropolitaine, 75011, France","(48.8546701, 2.3693933, 0.0)",48.8546701,2.3693933,0.0
237,france amerique latine,10547,29.54341736694678,education,,37 bd saintjacques 75014 paris france,,,,,,,,,,,
239,francodiff,2091,5.857142857142857,education,,marnela vallée chessy pl des passagers du vent 77700 chessy france,,,,,,,,,,,
240,francais du mondeadfe,15153,42.445378151260506,cso,,62 bd garibaldi 75015 paris france,,,,,,,"62, Boulevard Garibaldi, Quartier Necker, Paris 15e Arrondissement, Paris, Île-de-France, France métropolitaine, 75015, France","(48.8459763, 2.3075242, 0.0)",48.8459763,2.3075242,0.0
241,fraternite europe asie,87,0.24369747899159663,economic recovery and development,,17 rue du cardinal lemoine 75005 paris france,,,,,,,"17, Rue du Cardinal Lemoine, Quartier Saint-Victor, Paris 5e Arrondissement, Paris, Île-de-France, France métropolitaine, 75005, France","(48.8486135, 2.3537831, 0.0)",48.8486135,2.3537831,0.0
242,friendsinternational,24651,69.05042016806723,protection,,29 rue vaneau 75007 paris france,,,,,,,"29, Rue Vaneau, Quartier Saint-Thomas-d'Aquin, Paris 7e Arrondissement, Paris, Île-de-France, France métropolitaine, 75007, France","(48.8526752, 2.3191788, 0.0)",48.8526752,2.3191788,0.0
243,futuribles,3015,8.445378151260504,education,,47 rue de babylone 75007 paris france,,,,,,,"Coutume, 47, Rue de Babylone, Quartier Saint-Thomas-d'Aquin, Paris 7e Arrondissement, Paris, Île-de-France, France métropolitaine, 75007, France","(48.8516152, 2.3183721, 0.0)",48.8516152,2.3183721,0.0
244,genre en action,8962,25.103641456582633,human rights democracy and governance,,11 allée ausone 33607 pessac france,,,,,,,"Sciences Po Bordeaux, 11, Allée Ausone, Brivazac-Candau, Pessac, Bordeaux, Nouvelle-Aquitaine, France métropolitaine, 33607, France","(44.798599100000004, -0.6139021806866118, 0.0)",44.798599100000004,-0.6139021806866118,0.0
245,geres  acting for climate solidarity,2639,7.392156862745098,envirnoment,,2 cr maréchal foch 13400 aubagne france,,,,,,,,,,,
246,global ocean observing system,680,1.9047619047619047,environment,,7 pl de fontenoy 75352 paris france,,,,,,,"Place de Fontenoy, Quartier de l'École Militaire, Paris 7e Arrondissement, Paris, Île-de-France, France métropolitaine, 75007, France","(48.85121965, 2.306670824655578, 0.0)",48.85121965,2.306670824655578,0.0
247,greenpeace france,876230,2454.4257703081234,environment,,13 rue d'enghien 75010 paris france,,,,,,,"GreenPeace France, 13, Rue d'Enghien, Quartier de la Porte-Saint-Denis, Paris 10e Arrondissement, Paris, Île-de-France, France métropolitaine, 75010, France","(48.8717372, 2.3521223, 0.0)",48.8717372,2.3521223,0.0
248,groupe urd,1654,4.633053221288516,environment,,la font des marins 26170 plaisians france,,,,,,,,,,,
249,generations futures,28249,79.12885154061625,environment,,179 rue la fayette 75010 paris france,,,,,,,"179, Rue La Fayette, Quartier de l'Hôpital Saint-Louis, Paris 10e Arrondissement, Paris, Île-de-France, France métropolitaine, 75010, France","(48.8801367, 2.3598275, 0.0)",48.8801367,2.3598275,0.0
250,handicap international  humanity  inclusion,214969,602.1540616246499,human rights democracy and governance,,138 avenue des frères lumière 69008 lyon  france,,,,,,,"138, Avenue des Frères Lumière, Monplaisir, Lyon 8e Arrondissement, Lyon, Métropole de Lyon, Circonscription départementale du Rhône, Auvergne-Rhône-Alpes, France métropolitaine, 69008, France","(45.7432443, 4.8705184, 0.0)",45.7432443,4.8705184,0.0
251,helio international,224,0.6274509803921569,economic recovery and development,,75116 paris france,,,,,,,"Paris, Île-de-France, France métropolitaine, 75116, France","(48.868270471326156, 2.284165445085393, 0.0)",48.868270471326156,2.284165445085393,0.0
252,hera,1233,3.453781512605042,human rights democracy and governance,,15 rue beranger paris 75003 france,,,,,,,"15, Rue Béranger, Quartier des Enfants-Rouges, Paris 3e Arrondissement, Paris, Île-de-France, France métropolitaine, 75003, France","(48.8660891, 2.3636176, 0.0)",48.8660891,2.3636176,0.0
253,hes lgbti,2397,6.714285714285714,human rights democracy and governance,,20 rue edouard pailleron 75019 paris france,,,,,,,"20, Rue Édouard Pailleron, Quartier du Combat, Paris 19e Arrondissement, Paris, Île-de-France, France métropolitaine, 75019, France","(48.8804479, 2.3766239, 0.0)",48.8804479,2.3766239,0.0
254,human dignity,1635,4.579831932773109,human rights democracy and governance,,68 rue joseph de maistre 75018 paris france,,,,,,,"68, Rue Joseph de Maistre, Quartier des Grandes-Carrières, Paris 18e Arrondissement, Paris, Île-de-France, France métropolitaine, 75018, France","(48.890527, 2.3312658, 0.0)",48.890527,2.3312658,0.0
255,human rights watch en francais,131960,369.6358543417367,human rights democracy and governance,,142 rue montmartre 75002 paris france,,,,,,,"142, Rue Montmartre, Quartier du Mail, Paris 2e Arrondissement, Paris, Île-de-France, France métropolitaine, 75002, France","(48.8688839, 2.3433978, 0.0)",48.8688839,2.3433978,0.0
256,icc arbitration,11272,31.574229691876752,human rights democracy and governance,,3343 av du président wilson 75116 paris france,,,,,,,"Avenue du Président Wilson, Quartier de Chaillot, Paris 16e Arrondissement, Paris, Île-de-France, France métropolitaine, 75116, France","(48.864567, 2.2931936, 0.0)",48.864567,2.2931936,0.0
257,idate digiworld,1231,3.4481792717086837,education,,52 rue montmartre 75002 paris france,,,,,,,"52, Rue Montmartre, Quartier du Mail, Paris 2e Arrondissement, Paris, Île-de-France, France métropolitaine, 75002, France","(48.8652795, 2.3450112, 0.0)",48.8652795,2.3450112,0.0
258,institut europeen de cooperation et de developpement,6451,18.07002801120448,education,,20 rue de dantzig 75015 paris france,,,,,,,"20, Rue de Dantzig, Quartier Saint-Lambert, Paris 15e Arrondissement, Paris, Île-de-France, France métropolitaine, 75015, France","(48.8343618, 2.2993947, 0.0)",48.8343618,2.2993947,0.0
259,institut francais des relations internationales,107676,301.61344537815125,education,,27 rue de la procession 75015 paris france,,,,,,,"27, Rue de la Procession, Quartier Necker, Paris 15e Arrondissement, Paris, Île-de-France, France métropolitaine, 75015, France","(48.8383265, 2.3071478, 0.0)",48.8383265,2.3071478,0.0
260,iheal creda,5098,14.280112044817928,education,,5 cours des humanités 93322 aubervilliers france,,,,,,,"Recherche Sud (EHESS, Paris 1, Paris 3, Paris 13, IDA), 5, Cours des Humanités, Landy-Plaine - Marcreus - Pressensé, Aubervilliers, Saint-Denis, Seine-Saint-Denis, Île-de-France, France métropolitaine, 93300, France","(48.9085199, 2.3661494126966396, 0.0)",48.9085199,2.3661494126966396,0.0
261,ilci paris,863,2.4173669467787113,education,,4 rue véronèse 75013 paris france,,,,,,,"4, Rue Véronèse, Quartier de la Salpêtrière, Paris 13e Arrondissement, Paris, Île-de-France, France métropolitaine, 75013, France","(48.8341258, 2.3552784, 0.0)",48.8341258,2.3552784,0.0
262,inalco  langues o',21071,59.022408963585434,education,,2 rue de lille 75007 paris france,,,,,,,"2, Rue de Lille, Quartier Saint-Thomas-d'Aquin, Paris 7e Arrondissement, Paris, Île-de-France, France métropolitaine, 75007, France","(48.8577354, 2.3325384, 0.0)",48.8577354,2.3325384,0.0
263,initiative developpement poitiers,10629,29.77310924369748,economic recovery and development,,29 rue ladmirault 86000 poitiers france,,,,,,,"Rue Ladmirault, Les Montgorges, Poitiers, Vienne, Nouvelle-Aquitaine, France métropolitaine, 86000, France","(46.5840945, 0.3234629, 0.0)",46.5840945,0.3234629,0.0
264,institut d'etudes slaves,935,2.619047619047619,education,,9 rue michelet 75006 paris france,,,,,,,"9, Rue Michelet, Quartier de l'Odéon, Paris 6e Arrondissement, Paris, Île-de-France, France métropolitaine, 75006, France","(48.8424843, 2.3354027, 0.0)",48.8424843,2.3354027,0.0
265,institut de la protection sociale europeenne,62,0.17366946778711484,education,,92 bd de magenta 75010 paris france,,,,,,,"Philippine Mini Mart, 92, Boulevard de Magenta, Quartier Saint-Vincent-de-Paul, Paris 10e Arrondissement, Paris, Île-de-France, France métropolitaine, 75010, France","(48.8771713, 2.3555504, 0.0)",48.8771713,2.3555504,0.0
266,institut de medecine et d'epidemoiologie appliquee,16,0.04481792717086835,health,,46 rue henri huchard 75018 paris france,,,,,,,"Bichât, 46, Rue Henri Huchard, Quartier des Grandes-Carrières, Paris 18e Arrondissement, Paris, Île-de-France, France métropolitaine, 75018, France","(48.89953965, 2.3325203670032293, 0.0)",48.89953965,2.3325203670032293,0.0
267,institut de recherche our le developpement,26195,73.37535014005603,education,,44 bd de dunkerque 13002 marseille france,,,,,,,"Boulevard de Dunkerque, La Joliette, 2e Arrondissement, Marseille, Bouches-du-Rhône, Provence-Alpes-Côte d'Azur, France métropolitaine, 13002, France","(43.3048375, 5.36708, 0.0)",43.3048375,5.36708,0.0
268,institut du monde arabe,182622,511.546218487395,education,,1 rue des fossés saintbernard 75005 paris france,,,,,,,,,,,
269,institut international des droits de l'homme,14027,39.29131652661064,human rights democracy and governance,,2 all rené cassin 67000 strasbourg france,,,,,,,"2, Allée René Cassin, Quartier des XV, Strasbourg, Bas-Rhin, Grand Est, France métropolitaine, 67081, France","(48.5973809, 7.7753123, 0.0)",48.5973809,7.7753123,0.0
270,institute for economic studies  europe,6334,17.742296918767508,education,,35 av macmahon 75017 paris france,,,,,,,,,,,
271,international chamber of commerce,32334,90.57142857142857,economic recovery and development,,3343 av du président wilson 75116 paris france,,,,,,,"Avenue du Président Wilson, Quartier de Chaillot, Paris 16e Arrondissement, Paris, Île-de-France, France métropolitaine, 75116, France","(48.864567, 2.2931936, 0.0)",48.864567,2.2931936,0.0
272,international council of women,8161,22.859943977591037,human rights democracy and governance,,13 rue caumartin 75009 paris france,,,,,,,"13, Rue de Caumartin, Quartier de la Chaussée-d'Antin, Paris 9e Arrondissement, Paris, Île-de-France, France métropolitaine, 75009, France","(48.8710926, 2.3280361, 0.0)",48.8710926,2.3280361,0.0
273,international federation of catholic universities,559,1.5658263305322129,education,,9 21 rue d'assas 75006 paris france,,,,,,,"Rue d'Assas, Quartier Notre-Dame-des-Champs, Paris 6e Arrondissement, Paris, Île-de-France, France métropolitaine, 75006, France","(48.8456085, 2.3316929, 0.0)",48.8456085,2.3316929,0.0
274,international institute for research  human development,573,1.6050420168067228,education,,2 rue jean engling 1466 luxembourg,,,,,,,"2, Rue Jean Engling, Dommeldange, Luxembourg, Canton Luxembourg, 1466, Lëtzebuerg","(49.6389604, 6.1450645, 0.0)",49.6389604,6.1450645,0.0
275,international science council,18604,52.11204481792717,education,,5 rue auguste vacquerie 75116 paris france,,,,,,,"5, Rue Auguste Vacquerie, Quartier de Chaillot, Paris 16e Arrondissement, Paris, Île-de-France, France métropolitaine, 75116, France","(48.8708187, 2.2963325, 0.0)",48.8708187,2.2963325,0.0
276,international union again tuberculosis and lung disease,13264,37.15406162464986,health,,2 rue jean lantier 75001 paris france,,,,,,,"2, Rue Jean Lantier, Quartier Saint-Germain-l'Auxerrois, Paris 1er Arrondissement, Paris, Île-de-France, France métropolitaine, 75001, France","(48.8584336, 2.3469548, 0.0)",48.8584336,2.3469548,0.0
