,name,followers,degree_centrality,category,geodata,location,phone,email,webpage,twitter,description,Unnamed: 11,geoloc,point,latitude,longitude,altitude
101,sortir du colonialisme,10068,28.201680672268907,human rights democracy and governance,,21 rue voltaire  75011 paris france,  07 86 10 95 3007 86 10 95 30  ,jzl2805@yahoo.fr  ,http://www.anticolonial.net,,promouvoir les valeurs de l’anticolonialisme de la solidarité internationale de l’antiracisme ...,,"21, Rue Voltaire, Quartier Sainte-Marguerite, Paris 11e Arrondissement, Paris, Île-de-France, France métropolitaine, 75011, France","(48.8526381, 2.391742, 0.0)",48.8526381,2.391742,0.0
102,sos villages d’enfants,46286,129.65266106442576,protection,,6 cité monthiers 75 009 paris france,  33 01 55 07 25 2533 01 55 07 25 25  33 01 49 95 02 85 , contact@sosve.org  ,http://www.sosve.org/,,sos villages d’enfants france est une association indépendante apolitique et non confessionnelle...,,"6, Cité Monthiers, Quartier Saint-Georges, Paris 9e Arrondissement, Paris, Île-de-France, France métropolitaine, 75009, France","(48.8809299, 2.3275956, 0.0)",48.8809299,2.3275956,0.0
103,survival international france sif,310137,868.7310924369748,human rights democracy and governance,,18 rue ernest et henri rousselle  75013 paris france,  01 42 41 47 6201 42 41 47 62  , info@survivalfrance.org ,http://www.survivalfrance.org,,organisation mondiale de soutien aux peuples indigènes survival défend leur volonté de décider d...,,"18, Rue Ernest et Henri Rousselle, Quartier de la Maison-Blanche, Paris 13e Arrondissement, Paris, Île-de-France, France métropolitaine, 75013, France","(48.8254068, 2.3541752, 0.0)",48.8254068,2.3541752,0.0
104,transparency international france,12878,36.07282913165266,human rights democracy and governance,,14 passage dubail 75010 paris france,  01 84 16 95 6501 84 16 95 65  ,contact@transparency-france.org,http://www.transparency-france.org,,créée en 1995 et présidée depuis 2003 par daniel lebègue ancien directeur du trésor transparenc...,,"Centre de recherche et d'Information pour le Développement, 14, Passage Dubail, Quartier de la Porte-Saint-Martin, Paris 10e Arrondissement, Paris, Île-de-France, France métropolitaine, 75010, France","(48.8737094, 2.359693, 0.0)",48.8737094,2.359693,0.0
105,unicef,441195,1235.8403361344538,health,,3 rue duguaytrouin 75282 paris france, 09 69 36 84 68 09 69 36 84 68  ,contact@unicef.fr  ,http://www.unicef.fr,,les enfants sont le présent et l’avenir du monde. parce qu’ils ont besoin aujourd’hui d’être p...,,,,,,
106,union des associations burkinabé de france,1317,3.689075630252101,economic recovery and development,,181 avenue daumesnil 75012 paris france,  06 89 41 73 6606 89 41 73 66  , uabfrance@yahoo.fr  ,http://uabf.net/,,l’union des associations burkinabé de france u.a.b.f. convie toutes les associations ong et p...,,"181, Avenue Daumesnil, Quartier des Quinze-Vingts, Paris 12e Arrondissement, Paris, Île-de-France, France métropolitaine, 75012, France","(48.8406306, 2.392475, 0.0)",48.8406306,2.392475,0.0
107,union nationale des maisons familiales rurales d’education et d’orientation,13537,37.9187675070028,education,,58 rue notredame de lorette 75009 paris,  01 44 91 86 8601 44 91 86 86  01 44 91 95 45  ,unmfreo@mfr.asso.fr ,http://www.mfr.asso.fr,,a côté de leurs actions de formation et de développement en france le mouvement des maisons fami...,,,,,,
108,union peuple et culture pec,2454,6.873949579831932,education,,108 rue saintmaur 75011 paris france ,  01 49 29 42 8001 49 29 42 80  ,union@peuple-et-culture.org  ,http://www.peuple-et-culture.org,,l’union peuple et culture contribue à l’avènement d’un monde juste et solidaire d’une société d’...,,,,,,
109,acerrussie,472,1.3221288515406162,humanitarian,,91 rue olivier de serres 75015 paris france,  01 42 50 53 66  ,https://www.acer-mjo.org/fr/contact ,https://www.acer-mjo.org/fr/acer-russie,,acer-russie est une association d'aide humanitaire et sociale qui soutient des initiatives locales d’aide...,,"91, Rue Olivier de Serres, Quartier Saint-Lambert, Paris 15e Arrondissement, Paris, Île-de-France, France métropolitaine, 75015, France","(48.832199, 2.2935776, 0.0)",48.832199,2.2935776,0.0
110,act exchange,352,0.9859943977591037,economic recovery and development,,1a place des orphelins strasbourg france,06 44 64 22 22  ,contact@act.world  ,https://act.world,,l’association pour la culture et l’échange touristique act est une organisation à but non lucratif basée...,,"Place des Orphelins, Krutenau, Strasbourg, Bas-Rhin, Grand Est, France métropolitaine, 67065, France","(48.5785358, 7.7539289, 0.0)",48.5785358,7.7539289,0.0
111,acting for life,1685,4.719887955182073,economic recovery and development,,40 avenue de l'europe 93350 le bourget aeroport france,01 49 34 83 13  , contact@acting-for-life.org  ,https://acting-for-life.org/,,acting for life est une organisation française de solidarité internationale fondée en 1973 qui œuvre pour...,,,,,,
112,action autonomie avenir,123,0.3445378151260504,protection,,6 rue victor hugo 95100 argenteuil,01 34 10 34 04  ,,http://aaa-asso.fr/,,aaa est une association d’aide au développement aujourd’hui active au népal et au maroc...,,"6, Rue Victor Hugo, Ermont, Argenteuil, Val-d'Oise, Île-de-France, France métropolitaine, 95120, France","(48.987312349999996, 2.2586892679924215, 0.0)",48.987312349999996,2.2586892679924215,0.0
113,action contre la faim france,284460,796.8067226890756,humanitarian,,14 bd de douaumont 75017 paris france,01 70 84 70 84  ,https://www.actioncontrelafaim.org/contactez-nous/  ,https://www.actioncontrelafaim.org/,,créée en 1979 notre association loi 1901 est une organisation non-gouvernementale de solidarité...,,"14, Boulevard de Douaumont, Quartier des Batignolles, Paris 17e Arrondissement, Paris, Île-de-France, France métropolitaine, 75017, France","(48.8960324, 2.3077462, 0.0)",48.8960324,2.3077462,0.0
114,afal,1065,2.9831932773109244,education,,1 chemin de la laurina 33460 labarde france,01 74 64 44 73  ,afalassociation@gmail.com  ,http://www.afalassociation.com/,,association loi 1901 afal est l'union internationale d’associations et d’ong à vocation sectorielle ou...,,"Chemin de la Laurina, Clos de Gassion, Labarde, Lesparre-Médoc, Nouvelle-Aquitaine, France métropolitaine, 33460, France","(45.0227718, -0.6403062, 0.0)",45.0227718,-0.6403062,0.0
115,afdi  agriculteurs francais et developpment,3338,9.35014005602241,economic recovery and development,,11 rue de la baume 75008 paris france,01 42 89 58 16  ,,https://www.afdi-opa.org/,,grâce aux professionnels de l'agriculture engagés à ses côtés afdi soutient les agricultures familiales...,,"11, Rue de la Baume, Quartier de l'Europe, Paris 8e Arrondissement, Paris, Île-de-France, France métropolitaine, 75008, France","(48.8745642, 2.3116834, 0.0)",48.8745642,2.3116834,0.0
116,afea,392,1.0980392156862746,education,,4 rue des irlandais 75005 paris,,,,,,,"4, Rue des Irlandais, Quartier du Val-de-Grâce, Paris 5e Arrondissement, Paris, Île-de-France, France métropolitaine, 75005, France","(48.8444737, 2.3462045, 0.0)",48.8444737,2.3462045,0.0
117,afps  association france palenstine solidarite,21413,59.98039215686274,human rights democracy and governance,,21 ter rue voltaire 75011 paris france,01 43 72 15 79  , afps@france-palestine.org,https://www.france-palestine.org/,,l’association france palestine solidarité afps rassemble des personnes attachées au droit des peuples...,,"Rue Voltaire, Quartier Sainte-Marguerite, Paris 11e Arrondissement, Paris, Île-de-France, France métropolitaine, 75011, France","(48.8524844, 2.3913929, 0.0)",48.8524844,2.3913929,0.0
118,afrique verte international,3407,9.543417366946779,economic recovery and development,,66  72 rue marceau 93100 montreuil france,01 42 87 06 67  ,contact@afriqueverte.org,http://www.afriqueverte.org/,,avi est une organisation qui regroupe cinq membres intervenant dans quatre pays en afrique de l’ouest...,,"Rue Marceau, Bobillot, Montreuil, Bobigny, Seine-Saint-Denis, Île-de-France, France métropolitaine, 93100, France","(48.8546636, 2.4258991, 0.0)",48.8546636,2.4258991,0.0
119,agir ensemble pour les droits humains,3784,10.599439775910364,human rights democracy and governance,,16 av berthelot 69007 lyon france,04 37 37 10 11  , g.guichon@aedh.org   ,http://agir-ensemble-droits-humains.org/en/__trashed-2/,,notre vocation = s’allier avec les acteurs.rices de la société civile engagé.e.s sur leurs terrains dans la lutte...,,"16, Avenue Berthelot, Chevreul, Lyon 7e Arrondissement, Lyon, Métropole de Lyon, Circonscription départementale du Rhône, Auvergne-Rhône-Alpes, France métropolitaine, 69007, France","(45.7469182, 4.8361927, 0.0)",45.7469182,4.8361927,0.0
120,agrisud international,3740,10.476190476190476,economic recovery and development,,7 av du maréchal foch 33500 libourne france,05 57 25 17 06  ,http://www.agrisud.org/contact/  ,http://www.agrisud.org/fr/,,la petite ong d'une grande cause: permettre a des communautes humaines des pays du sud...,,"7, Avenue du Maréchal Foch, Centre-Ville, Château La Ganne, Libourne, Nouvelle-Aquitaine, France métropolitaine, 33500, France","(44.9215353, -0.24153920653409092, 0.0)",44.9215353,-0.24153920653409092,0.0
121,aide odonlogique internationale  aoi,1446,4.050420168067227,health,,1 rue maurice arnoux 92120 montrouge,01 57 63 99 62  ,contact@aoi-fr.org ,https://www.aoi-fr.org/,,aoi est une ong de développement qui contribue à l'amélioration de la santé orale. ,,"Faculté de Chirurgie Dentaire (Université de Paris), 1, Rue Maurice Arnoux, Quartier du Petit-Montrouge, Paris 14e Arrondissement, Quartier Portes de Montrouge, Montrouge, Antony, Hauts-de-Seine, Île-de-France, France métropolitaine, 92120, France","(48.82136145, 2.314645505352641, 0.0)",48.82136145,2.314645505352641,0.0
122,aides,70373,197.1232492997199,health,,36 rue dussoubs 75002 paris france,08 05 16 00 11 , https://www.aides.org/nous-contacter ,https://www.aides.org/,,aides est créée en septembre 1984 par le sociologue daniel defert à la suite du décès de son compagnon...,Multiple Locations across France,"36, Rue Dussoubs, Quartier de Bonne-Nouvelle, Paris 2e Arrondissement, Paris, Île-de-France, France métropolitaine, 75002, France","(48.8665789, 2.3493159, 0.0)",48.8665789,2.3493159,0.0
123,association of logical democracy agencies alda,10739,30.0812324929972,human rights democracy and governance,,1 avenue de l'europe 67000 strasbourg france,03 90 21 45 93  ,aldastrasbourg@alda-europe.eu  ,https://www.alda-europe.eu/,,l'alda - association européenne pour la démocratie locale est une association de droit français dédiée...,,"Totoro, 1, Avenue de l'Europe, Espace Européen de l'Entreprise, Schiltigheim, Strasbourg, Bas-Rhin, Grand Est, France métropolitaine, 67300, France","(48.6098846, 7.7125884, 0.0)",48.6098846,7.7125884,0.0
124,alima,23830,66.75070028011204,humanitarian,,15 rue des immeubles industriels 75011 paris,01 40 33 95 19  , office@alima.ngo  ,https://alima.ngo/,,l’histoire d’alima commence en 2009 au niger. alors que l’ensemble du corps médical observe un pic...,,"15, Rue des Immeubles Industriels, Quartier Sainte-Marguerite, Paris 11e Arrondissement, Paris, Île-de-France, France métropolitaine, 75011, France","(48.850025, 2.3924827, 0.0)",48.850025,2.3924827,0.0
125,alliance francaise paris iledefrance,106476,298.25210084033614,education,,101 bd raspail 75006 paris france,01 42 84 90 00  ,info@alliancefr.org ,https://www.alliancefr.org/,,l'alliance française est une organisation internationale qui vise à promouvoir l'apprentissage et...,,"Alliance française, 101, Boulevard Raspail, Quartier du Montparnasse, Paris 14e Arrondissement, Paris, Île-de-France, France métropolitaine, 75270, France","(48.84645535, 2.328989953365583, 0.0)",48.84645535,2.328989953365583,0.0
126,altersante,90,0.25210084033613445,health,,centre médical de bligny 91640 briissousforges,01 69 26 37 37  ,http://www.altersante.org/altersante/contact.html  ,http://www.altersante.org/altersante/,,des médecins et spécialistes de l’aide humanitaire ont décidé de s’unir afin de prévenir et traiter les maladies...,,,,,,
127,amnesty france peine de mort,2311,6.473389355742297,human rights democracy and governance,,76 boulevard de la villette  75940 paris cedex 19,01 53 38 65 65 ,01 53 38 65 65  no email  https://www.amnesty.fr/peine-de-mort-et-torture,https://www.amnesty.fr/peine-de-mort-et-torture,,on dit souvent “l’important c’est de participer”. mais lorsqu'il s’agit de droits humains l’important c’est aussi...,,,,,,
128,assistance medicale toit du monde amtm,2397,6.714285714285714,health,,81 av du maréchal joffre 92000 nanterre france,01 47 24 78 59  ,contact@amtm.org  ,https://www.amtm.org/,,amtm aide les communautés en inde et au népal en déployant son action selon trois axes : la santé et...,,"81, Avenue du Maréchal Joffre, Quartier du Plateau - Mont-Valérien, Nanterre, Arrondissement de Nanterre, Hauts-de-Seine, Île-de-France, France métropolitaine, 92000, France","(48.8840943, 2.1927247, 0.0)",48.8840943,2.1927247,0.0
129,apdra pisciculture paysanne,4721,13.224089635854341,health,,9 av de france 91300 massy france,01 69 20 38 49  ,contact@apdra.org  ,http://www.apdra.org/index.php/fr-fr/,,née en 1996 l'association apdra pisciculture paysanne soutient la pisciculture dans les pays du sud et...,,"9, Avenue de France, Les Peupliers, Massy, Palaiseau, Essonne, Île-de-France, France métropolitaine, 91300, France","(48.7327481, 2.2909895, 0.0)",48.7327481,2.2909895,0.0
130,assemblee parlementaire de la francophonie apf,7535,21.106442577030812,education,,233 bd saintgermain 75007 paris france,01 40 63 91 60  , http://www.apf.francophonie.org/contact.html  , http://www.apf.francophonie.org/ ,,l’assemblée parlementaire de la francophonie est un lieu de débats de propositions et d’échanges...,,,,,,
131,apprentis d'auteuil,65017,182.1204481792717,education,,40 rue jean de la fontaine 75016 paris,01 44 14 75 75  , https://www.apprentis-auteuil.org/nous-contacter.html  ,https://www.apprentis-auteuil.org/,,fondation catholique reconnue d’utilité publique apprentis d’auteuil s’engage et agit auprès des jeunes et...,,"40, Rue Jean de La Fontaine, Quartier d'Auteuil, Paris 16e Arrondissement, Paris, Île-de-France, France métropolitaine, 75016, France","(48.8510809, 2.2720294, 0.0)",48.8510809,2.2720294,0.0
132,aquassistance,1169,3.2745098039215685,humanitarian,,183 av du 18 juin 1940 92500 rueilmalmaison france,01 46 25 38 76 ,contact@aquassistance.org,https://www.aquassistance.org/page/242390-accueil,,créée en 1994 aquassistance est l'association de solidarité internationale des collaborateurs actifs et...,,,,,,
133,architectes de l'urgence,11301,31.65546218487395,economic recovery and development,,73 boulevard du cange 80000 amiens france,03 22 80 00 60 , info@archi-urgent.com  ,https://www.archi-urgent.com/ ,,depuis 2001 à travers ses programmes d’action dans le monde entier la fondation architectes de l’urgence...,Central logistics but have a headquarters in Paris,"Boulevard du Cange, Amiens, Somme, Hauts-de-France, France métropolitaine, 80000, France","(49.8959466, 2.3061165, 0.0)",49.8959466,2.3061165,0.0
134,architecture et developpement,1430,4.0056022408963585,economic recovery and development,,2 rue de la providence 75013 paris france,,,https://www.archidev.org/?lang=fr,,ad est une association de solidarité internationale fondée en 1997 qui conçoit et réalise des projets...,,"2, Rue de la Providence, Quartier de la Maison-Blanche, Paris 13e Arrondissement, Paris, Île-de-France, France métropolitaine, 75013, France","(48.8252395, 2.3494719, 0.0)",48.8252395,2.3494719,0.0
135,artisans du monde,13920,38.99159663865546,economic recovery and development,,14 rue de la beaune 93181 montreuil france,01 83 62 83 93  , https://www.artisansdumonde.org/contact/contactez-nous,https://www.artisansdumonde.org/,,depuis 1974 artisans du monde défend les droits humains la justice sociale et la solidarité internationale...,,"14, Rue de la Beaune, Centre-ville, Montreuil, Bobigny, Seine-Saint-Denis, Île-de-France, France métropolitaine, 93100, France","(48.8618309, 2.4359251, 0.0)",48.8618309,2.4359251,0.0
136,asdifle,4175,11.694677871148459,education,,101 bd raspail 75006 paris france,,https://asdifle.com/contact/,https://asdifle.com/,,l’association de didactique du français langue étrangère asdifle créée au milieu des années 1980...,,"Alliance française, 101, Boulevard Raspail, Quartier du Montparnasse, Paris 14e Arrondissement, Paris, Île-de-France, France métropolitaine, 75270, France","(48.84645535, 2.328989953365583, 0.0)",48.84645535,2.328989953365583,0.0
137,asi  actions de solidarite internationale,1767,4.949579831932773,protection,,5 rue lebon 75017 paris france,242 06 688 5964  ,contact@asi-france.org  ,https://www.asi-france.org/,,asi travaille sur le long terme par le soutien d’initiatives locales c’est une ong de développement.,,"5, Rue Lebon, Quartier des Ternes, Paris 17e Arrondissement, Paris, Île-de-France, France métropolitaine, 75017, France","(48.8806784, 2.2923066, 0.0)",48.8806784,2.2923066,0.0
138,asi  association de la sommellerie internationale,27833,77.96358543417367,education,,97 boulevard haussmann 75008 paris france,, info@asi.info  ,https://www.asi.info/,,l’association de la sommellerie internationale asi est une organisation à but non-lucratif fondée à reims...,,"97, Boulevard Haussmann, Quartier de l'Europe, Paris 8e Arrondissement, Paris, Île-de-France, France métropolitaine, 75008, France","(48.8748202, 2.318194, 0.0)",48.8748202,2.318194,0.0
139,assen association de soutien aux enfants,11893,33.31372549019608,protection ,,181 av daumesnil 75012 paris france,,https://assen-asso.org/contacts/  ,https://assen-asso.org/,,l’association de soutien aux enfants assen a été créée le 5 novembre 2010 par des jeunes étudiants...,,"181, Avenue Daumesnil, Quartier des Quinze-Vingts, Paris 12e Arrondissement, Paris, Île-de-France, France métropolitaine, 75012, France","(48.8406306, 2.392475, 0.0)",48.8406306,2.392475,0.0
140,association adric,575,1.6106442577030813,education,,7 rue du jura 75013 paris france,01 43 36 89 23  , adric@adric.eu ,https://www.adric.eu/,,créée en 2003 l’agence de développement des relations interculturelles pour la citoyenneté adric...,,"7, Rue du Jura, Quartier de la Salpêtrière, Paris 13e Arrondissement, Paris, Île-de-France, France métropolitaine, 75013, France","(48.8375471, 2.356103, 0.0)",48.8375471,2.356103,0.0
141,association henri capitant,2303,6.450980392156863,education,,12 pl du panthéon 75005 paris france,01 43 54 43 17  ,contact@henricapitant.org  ,https://www.henricapitant.org/,,l’association henri capitant fut fondée en 1935 sous l’autorité de henri capitant professeur à la faculté de...,,"Université Paris I Panthéon-Sorbonne, 12, Place du Panthéon, Quartier de la Sorbonne, Paris 5e Arrondissement, Paris, Île-de-France, France métropolitaine, 75005, France","(48.84708575, 2.344087797715906, 0.0)",48.84708575,2.344087797715906,0.0
142,atd fourth world,3308,9.266106442577032,human rights democracy and governance,,12 rue pasteur 95480 pierrelaye france,,,,,,,"Rue Pasteur, Résidence du Petit Bois, Pierrelaye, Argenteuil, Val-d'Oise, Île-de-France, France métropolitaine, 95480, France","(49.0202506, 2.1500935, 0.0)",49.0202506,2.1500935,0.0
143,attac france,153634,430.3473389355742,human rights democracy and governance,,21ter rue voltaire 75011 paris france,,,,,,,"Rue Voltaire, Quartier Sainte-Marguerite, Paris 11e Arrondissement, Paris, Île-de-France, France métropolitaine, 75011, France","(48.8524844, 2.3913929, 0.0)",48.8524844,2.3913929,0.0
145,auxilaires du sacerdoce,170,0.47619047619047616,religious,,57 rue lemercier 75017 paris france,,,,,,,"57, Rue Lemercier, Quartier des Batignolles, Paris 17e Arrondissement, Paris, Île-de-France, France métropolitaine, 75017, France","(48.8875833, 2.32188, 0.0)",48.8875833,2.32188,0.0
146,avocats sans frontieres france,7825,21.9187675070028,human rights democracy and governance,,8 rue du prieuré 31000 toulouse france,,,,,,,"8, Rue du Prieuré, Place Occitane, Capitole, Toulouse Centre, Toulouse, Haute-Garonne, Occitanie, France métropolitaine, 31000, France","(43.6016272, 1.4417115, 0.0)",43.6016272,1.4417115,0.0
147,avsfagronomes et veterinaires sans frontieres,47255,132.36694677871148,economic recovery and development,,14 av berthelot 69007 lyon france,,,,,,,"14, Avenue Berthelot, Chevreul, Lyon 7e Arrondissement, Lyon, Métropole de Lyon, Circonscription départementale du Rhône, Auvergne-Rhône-Alpes, France métropolitaine, 69007, France","(45.7470377, 4.8357977, 0.0)",45.7470377,4.8357977,0.0
148,bewelcome,7486,20.969187675070028,education,,19 rue de paris 35500 vitre france,,,,,,,"19, Rue de Paris, Hospice St Nicolas, Vitré, Fougères-Vitré, Ille-et-Vilaine, Bretagne, France métropolitaine, 35500, France","(48.1245906, -1.2073464, 0.0)",48.1245906,-1.2073464,0.0
149,biacthevoice of oecd business,48,0.13445378151260504,economic recovery and development,,13/15 chau de la muette 75016 paris france,,,,,,,,,,,
150,bibliotheques sans frontieres,148833,416.89915966386553,education,,69 rue armand carrel 75019 paris france,,,,,,,"Les Marmites Volantes, 69, Rue Armand Carrel, Quartier du Combat, Paris 19e Arrondissement, Paris, Île-de-France, France métropolitaine, 75019, France","(48.8827997, 2.3733397, 0.0)",48.8827997,2.3733397,0.0
151,bice  burea international catholique de l'enfance,6614,18.526610644257705,protection,,70 boulevard de magenta  75010 paris,,,,,,,"70, Boulevard de Magenta, Quartier de la Porte-Saint-Martin, Paris 10e Arrondissement, Paris, Île-de-France, France métropolitaine, 75010, France","(48.8753491, 2.3571384, 0.0)",48.8753491,2.3571384,0.0
152,biodeversa,1787,5.0056022408963585,environment,,50 av daumesnil 75012 paris france,,,,,,,"50, Avenue Daumesnil, Quartier des Quinze-Vingts, Paris 12e Arrondissement, Paris, Île-de-France, France métropolitaine, 75012, France","(48.8456409, 2.3784003, 0.0)",48.8456409,2.3784003,0.0
153,cafebabel,13631,38.182072829131656,education,,226 rue saintdenis 75002 paris france,,,,,,,,,,,
154,ccfdterre solidaire,175226,490.8291316526611,human rights democracy and governance,,7 rue du frout 29000 quimper france,,,,,,,"7, Rue du Frout, La Tourelle, Quimper, Finistère, Bretagne, France métropolitaine, 29000, France","(47.9959315, -4.1003447, 0.0)",47.9959315,-4.1003447,0.0
155,centre d'etudes europeennes et de politique comparee de science po,1531,4.288515406162465,education,,28 rue des saintspères 75007 paris france,,,,,,,,,,,
156,centre de documentation tiers monde,69,0.19327731092436976,education,,27 bd louis blanc 34000 montpellier france,,,,,,,"27, Boulevard Louis Blanc, Les Beaux-Arts, Centre, Montpellier, Hérault, Occitanie, France métropolitaine, 34000, France","(43.6144863, 3.8802663, 0.0)",43.6144863,3.8802663,0.0
157,centre humanitaire des metiers de la pharmaciechmp,28,0.0784313725490196,health,,4 voie militaire des gravanches 63100 clermontferrand france,,,,,,,,,,,
158,centre international de credit mutuel,75,0.21008403361344538,economic recovery and development,,88 rue cardinet 75847 paris cedex 17,,,,,,,,,,,
159,cerale,98,0.27450980392156865,education,,79 av de la république 75011 paris france,,,,,,,"79, Avenue de la République, Quartier de la Folie-Méricourt, Paris 11e Arrondissement, Paris, Île-de-France, France métropolitaine, 75011, France","(48.8642945, 2.3804192, 0.0)",48.8642945,2.3804192,0.0
161,cfdt,24514,68.66666666666667,professional society,,49 av dufau 64000 pau france,,,,,,,"Avenue Dufau, Dufau-Tourasse, Pau, Pyrénées-Atlantiques, Nouvelle-Aquitaine, France métropolitaine, 64000, France","(43.3046592, -0.3681633, 0.0)",43.3046592,-0.3681633,0.0
162,chambre de commerce franco arabe,529,1.4817927170868348,economic recovery and development,,250 bis bd saintgermain 75007 paris france,,,,,,,,,,,
163,children's rights  humanium,96727,270.9439775910364,human rights democracy and governance,,5 rue de l’automne 68510 sierentz france,,,,,,,"5, Rue de l'Automne, Sierentz, Mulhouse, Haut-Rhin, Grand Est, France métropolitaine, 68510, France","(47.6603739, 7.4531226, 0.0)",47.6603739,7.4531226,0.0
164,cicp,562,1.5742296918767507,human rights democracy and governance,,21ter rue voltaire 75011 paris france,,,,,,,"Rue Voltaire, Quartier Sainte-Marguerite, Paris 11e Arrondissement, Paris, Île-de-France, France métropolitaine, 75011, France","(48.8524844, 2.3913929, 0.0)",48.8524844,2.3913929,0.0
165,cid centre interculturel du developpment,537,1.504201680672269,education,,8 cité de l'ameublement 75011 paris france,,,,,,,"8, Cité de l'Ameublement, Quartier Sainte-Marguerite, Paris 11e Arrondissement, Paris, Île-de-France, France métropolitaine, 75011, France","(48.8511702, 2.3857037, 0.0)",48.8511702,2.3857037,0.0
166,ciemi,296,0.8291316526610645,education,,46 rue de montreuil 75011 paris france,,,,,,,"Mission Catholique Italienne, 46, Rue de Montreuil, Quartier Sainte-Marguerite, Paris 11e Arrondissement, Paris, Île-de-France, France métropolitaine, 75011, France","(48.850155, 2.3884949, 0.0)",48.850155,2.3884949,0.0
167,cigref,751,2.103641456582633,professional society,,21 av de messine 75008 paris france,,,,,,,"21, Avenue de Messine, Quartier de l'Europe, Paris 8e Arrondissement, Paris, Île-de-France, France métropolitaine, 75008, France","(48.8768551, 2.311613, 0.0)",48.8768551,2.311613,0.0
168,ciheam,4974,13.932773109243698,economic recovery and development,,via ceglie 9 70010 valenzano ba italie,,,,,,,,,,,
